home_team,away_team,text,author,venue,referee,odds,odds_home_team,odds_away_team,odds_draw,preview_date,preview_link
Bolton Wanderers,Tottenham Hotspur,"Old Trafford, where they have not won since 1989, is famously one of Tottenham's great hoodoo grounds. But there is another part of Greater Manchester where Spurs come regularly and spectacularly to grief – the Reebok, where they have never won in the Premier League. Jermain Defoe's broken hand, sustained in the 5-0 rout of Burnley last Saturday, could force Harry Redknapp to play Peter Crouch up front, although given Bolton's physical game, the Tottenham manager might have done that anyway. His counterpart, Gary Megson, will be without Johan Elmander but buoyed by four games without defeat. Tim Rich",Tim Rich,Reebok Stadium,M Jones,"['13-5', '10-11', '23-10']",3.6,1.9090909090909092,3.3,2009-10-02,https://www.theguardian.com/football/2009/oct/02/squad-sheets-bolton-wanderers-tottenham-hotspur
Manchester City,Hull City,"Hull's previous visit to Eastlands ended in a 5-1 rout, and Phil Brown's notorious half-time on-pitch team talk in front of the travelling fans who had just witnessed their side concede four unanswered goals. Brown will not wish his men's recent uplifting sequence of results in the Premier League to have a loss added to it, and certainly not by four goals. Mark Hughes, meanwhile, is hopeful Robinho will finally return to City's squad, though how happy the manager is to have the temperamental Brazilian back in the dressing room is moot. Jamie Jackson",Jamie Jackson,City of Manchester Stadium,L Probert,"['2-9', '10-1', '21-5']",1.2222222222222223,11.0,5.2,2009-11-27,https://www.theguardian.com/football/2009/nov/27/squad-sheets-manchester-city-hull-city
Manchester City,Fulham,"Mark Hughes will have half an eye on events at Anfield when his side welcome Fulham to Eastlands. City are within touching distance of the Premier League summit and Liverpool's recent poor form will have reinforced their self-belief. Fulham were the last team to beat City at home in the league and under Roy Hodgson's stewardship have looked to improve again this term. Denied victory over Roma in the last minute on Thursday night, Fulham will be out to dampen the City fans' early-season optimism. Chris Bell",Chris Bell,City of Manchester Stadium,K Friend,"['2-5', '13-2', '3-1']",1.4,7.5,4.0,2009-10-23,https://www.theguardian.com/football/2009/oct/23/squad-sheets-manchester-city-fulham
Sunderland,Everton,"Confidence could well be in short supply with Sunderland having managed just one win in their last nine league games and Everton one in 11. ""I'm worried, we're at the wrong end of the table,"" says David Moyes, the visiting manager, whose injury ravaged side are two points above the relegation zone. Steve Bruce remains slightly brighter. ""We're making progress,"" says Sunderland's manager. Ellis Short, the club's billionaire owner has stayed quietly supportive but will now be seeking clear evidence of an upturn. Louise Taylor",Louise Taylor,Stadium of Light,M Atkinson,"['13-10', '9-5', '11-5']",2.3,2.8,3.2,2009-12-24,https://www.theguardian.com/football/2009/dec/24/squad-sheets-sunderland-everton
Fulham,Tottenham Hotspur,"Teams are increasingly viewing trips to Craven Cottage with dread. Tottenham must attempt to avoid the fate that has befallen the likes of Manchester United and Liverpool to maintain their pursuit of the top four at a ground where they have not prevailed in the Premier League in seven years. Roy Hodgson's resurgent side are unbeaten in seven matches in all competitions and unbeaten at home since September, with their former Spurs Bobby Zamora and Danny Murphy ticking over impressively at present. It says everything about the Cottagers' progress this term that they are only three points off Manchester City, a side who have spent in excess of £200m and entertain serious hopes of breaking into the Champions League positions. Dominic Fifield",Dominic Fifield,Craven Cottage,S Bennett,"['17-10', '27-20', '9-4']",2.7,2.35,3.25,2009-12-24,https://www.theguardian.com/football/2009/dec/24/squad-sheets-fulham-tottenham-hotspur
Blackburn Rovers,Tottenham Hotspur,"Even without organising Tottenham's secret Christmas party in Dublin, Robbie Keane might not have expected to start this game. The way in which Jermain Defoe and Peter Crouch combined to overwhelm Manchester City should convince Harry Redknapp to keep faith with his English strike pairing. Tottenham, who have failed to win at Ewood Park in their last four attempts, are in need of a convincing away display – they have only forced one league win outside White Hart Lane since overcoming West Ham in August. Tim Rich",Tim Rich,Ewood Park,P Walton,"['2-1', '6-5', '11-5']",3.0,2.2,3.2,2009-12-18,https://www.theguardian.com/football/2009/dec/18/squad-sheets-blackburn-rovers-tottenham-hotspur
Birmingham City,West Ham United,"This is a meeting between clubs travelling in very different directions. Birmingham are enjoying their best start to a Premier League season and are looking for a fourth successive win to cement their place in the top half while West Ham continue to concede goals at an alarming rate and hover precariously above the relegation zone. Alex McLeish's side are set to be unchanged following their victory over Wigan. West Ham, meanwhile, should have Robert Green available to provide some experience to a porous defence. Stuart James",Stuart James,St Andrew's,L Mason,"['11-10', '11-5', '11-5']",2.1,3.2,3.2,2009-12-11,https://www.theguardian.com/football/2009/dec/11/birmingham-city-west-ham-united
Birmingham City,Manchester City,"Not a day for Birmingham City fans to be boasting about their riches. The £40m that Carson Yeung has pledged to make available to Alex McLeish in January is a drop in the ocean compared to the sums that Manchester City's owners have spent. City, however, have stuttered of late, with their last three league matches all ending as draws. Birmingham will also take encouragement from their much-needed victory over Sunderland last Saturday and the defensive lapses that have seen City fail to keep a clean sheet since the end of August. Stuart James",Stuart James,St Andrew's,M Dean,"['57-20', '17-20', '23-10']",3.85,1.85,3.3,2009-10-30,https://www.theguardian.com/football/2009/oct/30/squad-sheets-birmingham-city-manchester-city
Stoke City,Portsmouth,"Perhaps Sky should have considered dropping the 'Super' prefix of their live Sunday package when pairing this game with Bolton v Blackburn but an apathetic audience should not overlook the importance that this fixture holds for either side. Last month Pompey were encouraged by their 4-0 Carling Cup win over Stoke but this time the home side's manager, Tony Pulis, should hold the whip hand against his struggling former employers, even if he chooses to omit his fatigued Ireland players Liam Lawrence and Glenn Whelan. James Callow",James Callow,Britannia Stadium,K Friend,"['11-10', '21-10', '23-10']",2.1,3.1,3.3,2009-11-20,https://www.theguardian.com/football/2009/nov/20/squad-sheets-stoke-city-portsmouth
Portsmouth,Manchester United,"Rarely are Manchester United not the focus ahead of one of their fixtures but the appointment of Avram Grant as Portsmouth's fourth manager in 13 months has clearly shifted the spotlight away from the champions. The Israeli is seeking what would only be Pompey's fourth win of the season and so United are hardly ideal first opponents. Grant can, though, see this game as a chance to seek revenge for Chelsea's 2008 Champions League final defeat when he came within a John Terry penalty of landing the trophy. Sachin Nakrani",Sachin Nakrani,Fratton Park,M Dean,"['7-1', '1-3', '7-2']",8.0,1.3333333333333333,4.5,2009-11-27,https://www.theguardian.com/football/2009/nov/27/squad-sheets-portsmouth-manchester-united
Manchester City,Stoke City,"There could be no better test as Roberto Mancini's first game as Manchester City manager, since failure to beat the likes of Burnley, Bolton and Hull was the principal reason Mark Hughes lost his job. Mancini was asked pointedly at his first press conference how he intended to deal with Rory Delap to test his knowledge of Stoke's style of play. Given that Manchester City's expensively-assembled defence has conceded nine times in their last three matches, there is considerable room for improvement. Up front Mancini may feel under pressure to restore Robinho and Emmanuel Adebayor, both discarded by Hughes in his final game. Tim Rich",Tim Rich,City of Manchester Stadium,L Mason,"['2-5', '25-4', '3-1']",1.4,7.25,4.0,2009-12-24,https://www.theguardian.com/football/2009/dec/24/squad-sheets-manchester-city-stoke-city
Wolverhampton Wanderers,Birmingham City,"If Mick McCarthy is not to repeat the hopeless fight against relegation he endured at Sunderland, much will depend on the next three fixtures at Molineux, where Wolves face Birmingham, Bolton and Burnley, because there is unlikely to be much comfort on the road. After a 4-0 battering at Chelsea, Wolves will travel to White Hart Lane, Old Trafford and Anfield. Their record signing, striker Kevin Doyle, should return against a Birmingham side that has taken eight points from four games, although manager Alex McLeish is aware that only Portsmouth have scored fewer goals. Tim Rich ",Tim Rich ,,M Clattenburg,"['13-10', '9-5', '11-5']",2.3,2.8,3.2,2009-11-27,https://www.theguardian.com/football/2009/nov/27/squad-sheets-wolverhampton-wanderers-birmingham-city
Arsenal,Blackburn Rovers,"Sam Allardyce is unlikely to make the same mistake he did last season, when Blackburn were uncharacteristically timid and let Arsenal pick them off. With the Gunners averaging three goals per game in the Premier League the Emirates crowd can expect a more abrasive resistance from Rovers of the type that so unnerved them when Allardyce was at Bolton. Patience may again be required for Wenger's men and Theo Walcott will be desperate to get in on the act for what would be his first appearance of the season. Amy Lawrence",Amy Lawrence,Emirates Stadium,P Walton,"['2-9', '9-1', '9-2']",1.2222222222222223,10.0,5.5,2009-10-02,https://www.theguardian.com/football/2009/oct/02/squad-sheets-arsenal-blackburn-rovers
Stoke City,West Ham United,"For Gianfranco Zola it's a question of when does a bad run become a crisis? The West Ham manager has not seen his side win in the league since the opening day and witnessed them keep only two clean sheets so far this campaign. The Italian has plenty to ponder, then, as he travels to the Potteries. Stoke, meanwhile, are comfortably ensconced in mid-table and will look to exploiting any uncertainty in the Hammers defence. They, however, will have to be wary of Carlton Cole, who has already scored four times this season. Patrick Curry",Patrick Curry,Britannia Stadium,M Atkinson,"['11-10', '11-5', '11-5']",2.1,3.2,3.2,2009-10-16,https://www.theguardian.com/football/2009/oct/16/squad-sheets-stoke-city-west-ham
West Ham United,Burnley,"Burnley will be hoping to secure a first win at Upton Park in over 30 years and will be encouraged by the news that West Ham captain Matthew Upson will be unavailable after suffering a hamstring strain in training. Danny Gabbidon is now fully fit after an abdominal injury and should step into the gap for Gianfranco Zola's side, who have won only one league match since the opening day of this season. Burnley manager Owen Coyle has no new fitness concerns and is likely to stick with the same side that drew with Aston Villa last week. Richard Flower",Richard Flower,Upton Park,C Foy,"['3-4', '11-4', '11-4']",1.75,3.75,3.75,2009-11-27,https://www.theguardian.com/football/2009/nov/27/squad-sheets-west-ham-burnley
Everton,Tottenham Hotspur,Victory over AEK Athens in midweek gave David Moyes the perfect PR opportunity to spin Everton's second win in 12 matches as the turning point of a miserable season. He declined by virtue of common sense. Qualification for the knockout phase of the Europa League came at a cost of three more injuries and Everton must call on either Shane Duffy or Seamus Coleman – with a grand total of nine minutes experience in the Premier League between them – should Joseph Yobo fail to recover from a hamstring strain against an exuberant Tottenham Hotspur team unbeaten at Goodison Park since April 2004. Andy Hunter,Andy Hunter,Goodison Park,A Marriner,"['17-10', '7-5', '11-5']",2.7,2.4,3.2,2009-12-04,https://www.theguardian.com/football/2009/dec/04/squad-sheets-everton-tottenham-hotspur
Liverpool,Manchester City,"This is a fixture with the potential to reinforce the impression that there are changes afoot in the make-up of the elite, with Manchester City intent on breaking into the top four. There is, however, a lot of work still to be done by a team that has drawn five Premier League games in a row after winning five of their first six. Conversely, Liverpool have players like Steven Gerrard and Alberto Aquilani nearing full fitness and the side is just three points short of fourth place despite their unconvincing recent run of form. Kevin McCarra",Kevin McCarra,Anfield,P Dowd,"['9-10', '13-5', '12-5']",1.9,3.6,3.4,2009-11-20,https://www.theguardian.com/football/2009/nov/20/squad-sheets-liverpool-manchester-city
Wolverhampton Wanderers,Aston Villa,"Aston Villa have made their best start to a season for 10 years and make the short trip to Molineux in confident mood following last Saturday's win over Chelsea. Wolves have failed to beat their neighbours in 14 matches, dating back to 1980, but Mick McCarthy's side can take comfort from the fact that both of Villa's defeats in the league this season have come against teams in the bottom half. Villa are likely to be unchanged, while McCarthy is expected to bring back Michael Mancienne, who has recovered from a virus. Stuart James",Stuart James,Molineux,S Bennett,"['13-5', '19-20', '9-4']",3.6,1.95,3.25,2009-10-23,https://www.theguardian.com/football/2009/oct/23/squad-sheets-wolves-aston-villa
Fulham,Hull City,"With Fulham having already played 14 games this season, and now facing a midweek visit to Roma, Roy Hodgson will have been glad of the rest the international break provided for some of his squad. Phil Brown's first ever top-flight victory came over Fulham, but a lot has changed since then. Despite a much-needed victory over Wigan, Hull still sit in the bottom three and will need to shore up the worst defensive record in the Premier League if they are to avoid the relegation worries that engulfed them last season. Patrick Curry",Patrick Curry,Craven Cottage,A Marriner,"['13-20', '15-4', '5-2']",1.65,4.75,3.5,2009-10-16,https://www.theguardian.com/football/2009/oct/16/fulham-hull-city-squad-sheets
Bolton Wanderers,Blackburn Rovers,"Neither side stands out as probable winners of this contest if recent form is anything to go by. Bolton have won one of their six home matches while Blackburn have lost all five away from Ewood Park. Both encounters between these sides ended level last season and a repeat result is far from inconceivable. Bolton will almost certainly be without joint top-scorer Tamir Cohen, who is unlikely to overcome a groin problem while Blackburn will check on Keith Andrews, who ran himself ragged for Ireland against France in midweek. Richard Flower",Richard Flower,Reebok Stadium,M Dean,"['11-10', '11-5', '9-4']",2.1,3.2,3.25,2009-11-20,https://www.theguardian.com/football/2009/nov/20/squad-sheets-bolton-wanderers-blackburn-rovers
West Ham United,Portsmouth,"Both these teams are struggling in the Premier League and face deep uncertainty in January. The hosts may be forced to sell their best players to pay off their debts while Portsmouth, who are not without financial dilemmas of their own, could lose several players to the African Cup of Nations. West Ham will look to build on the point they picked up at top of the table Chelsea last time out but they must stop leaking goals at home if they are to have any chance of pulling away from the relegation zone. Avram Grant must continue to cope without England goalkeeper David James in the visitor's goal, with Asmir Begovic set to continue to deputise. Richard Flower",Richard Flower,Upton Park,L Probert,"['11-10', '11-5', '11-5']",2.1,3.2,3.2,2009-12-24,https://www.theguardian.com/football/2009/dec/24/squad-sheets-west-ham-united-portsmouth
Liverpool,Arsenal,"Liverpool's involvement in this season's Champions League has now ended and the time has come to prove that they have the means to quickly return to the top four. They will be aided by Fernando Torres' return to fitness, but Arsenal, having sent a shadow squad to meet Olympiakos in midweek ought to be fresh. This, too, is an opportunity to defy those who cannot accept the club as credible contenders for the title. Theo Walcott, who did play 90 minutes in Greece, must be out to re-establish himself with club and country. Kevin McCarra",Kevin McCarra,Anfield,H Webb,"['11-10', '11-5', '11-5']",2.1,3.2,3.2,2009-12-11,https://www.theguardian.com/football/2009/dec/11/liverpool-arsenal-squad-sheets
Wolverhampton Wanderers,Portsmouth,"Molineux welcomes a club in complete and utter crisis. Bottom of the league with zero points, so impoverished that they cannot even pay wages to their players and now having to deal with their owner, Sulaiman al-Fahim, being in hospital, Portsmouth's supporters must be wondering when the misery will end. They can take hope, however, from their side's showing in last week's 1-0 defeat to Everton, when they deserved to win, as well as from Wolves' porous defending during their 5-2 defeat at Sunderland last Sunday. Sachin Nakrani",Sachin Nakrani,Molineux,H Webb,"['11-10', '11-5', '11-5']",2.1,3.2,3.2,2009-10-02,https://www.theguardian.com/football/2009/oct/02/squad-sheets-wolverhampton-wanderers-portsmouth
Tottenham Hotspur,Wolverhampton Wanderers,"Looks a straightforward home win for Tottenham against a Wolves team whose defence is still struggling to come to terms with the demands of the Premier League. Spurs, however, are just as leaky at the back – between them the teams have kept three clean sheets in the league this season – so Mick McCarthy's side may get a goal or two. Harry Redknapp's first-choice centre-backs, Ledley King and Jonathan Woodgate, keep going lame and his team's habit of letting opponents off the hook will give Wolves some hope. David Lacey",David Lacey,White Hart Lane,S Attwell,"['1-4', '9-1', '4-1']",1.25,10.0,5.0,2009-12-11,https://www.theguardian.com/football/2009/dec/11/tottenham-wolves-squad-sheets
Manchester United,Everton,"Wayne Rooney has five goals against his former club since his £20m move to Old Trafford and a sixth could help arrest a worrying trend for the England striker. Since the birth of son Kai on 2 November the first-time father has failed to emerge on the winning side in any of the three matches he has been involved in. Perhaps Everton defender Tony Hibbert could raise the issue with his erstwhile team-mate this evening. ""There's always banter with Wayne and I talk to him a lot throughout the games,"" said Hibbert. Mikey Stafford",Mikey Stafford,Old Trafford,S Bennett,"['7-20', '7-1', '16-5']",1.35,8.0,4.2,2009-11-20,https://www.theguardian.com/football/2009/nov/20/squad-sheets-manchester-united-everton
Blackburn Rovers,Burnley,"Burnley's results on the road in the Premier League so far; 0-2, 0-3, 0-4, 0-5. The consequences of that miserable sequence continuing at Ewood Park do not bear thinking about. Strip away the raw emotion of the east Lancashire derby, a tall order admittedly, and Owen Coyle's clear priority is to inject some Turf Moor resilience into a Burnley team beset by injuries to key players. Opposite number Sam Allardyce simply wants a repeat of Blackburn's last home game; a 10-man victory over Aston Villa he has labelled ""one of the biggest results I've ever had as a Premier League manager"". Andy Hunter",Andy Hunter,Ewood Park,C Foy,"['7-10', '7-2', '12-5']",1.7,4.5,3.4,2009-10-16,https://www.theguardian.com/football/2009/oct/16/blackburn-rovers-burnley-squad-sheets
Arsenal,Aston Villa,"A crucial match for both sides appears to be particularly defining for the visitors. Aston Villa entered the new season concerned that they would fail to make the Europa League but having won their last four matches, including a 1-0 triumph at Old Trafford, they are now well ensconced in the Champions League places. Victory over Arsenal would not only see Villa strengthen their position further by leapfrogging the Londoners into third, it would also give their supporters real cause to dream of a title assault in 2010. Sachin Nakrani",Sachin Nakrani,Emirates Stadium,P Dowd,"['3-5', '17-4', '5-2']",1.6,5.25,3.5,2009-12-24,https://www.theguardian.com/football/2009/dec/24/squad-sheets-arsenal-aston-villa
Wigan Athletic,Manchester City,"Mark Hughes may have spent £120m in the summer but the Manchester City manager has been left fretting about the size of his squad going into Sunday's match, with 11 players either out or struggling because of injury problems. Wigan beat Chelsea in their last match and Roberto Martínez could be forgiven for sensing that City might be vulnerable to another upset given the list of possible absentees, including Robinho, Kolo Touré and the in-form Craig Bellamy. The most pressing concern for Hughes is that all four of his first-choice defenders are having treatment. Daniel Taylor",Daniel Taylor,DW Stadium,A Wiley,"['15-4', '13-20', '5-2']",4.75,1.65,3.5,2009-10-16,https://www.theguardian.com/football/2009/oct/16/squad-sheets-wigan-athletic-manchester-city
Manchester City,Burnley,"Burnley's away record (five games, five defeats) should encourage Manchester City to believe they can pull out of a four-draw drift. Owen Coyle has little slack in his squad and injuries will probably persuade him to field the same starting XI, which includes two former City full-backs, Stephen Jordan and Tyrone Mears. City expect to welcome back two absentees from the goalless draw at Birmingham, Emmanuel Adebayor and Kolo Touré, who together cost £41m, which is £38m more than Burnley paid for Stephen Fletcher, their record signing. It hardly seems fair but Burnley keep on attacking, even away. Jeremy Alexander",Jeremy Alexander,City of Manchester Stadium,S Attwell,"['3-10', '8-1', '7-2']",1.3,9.0,4.5,2009-11-06,https://www.theguardian.com/football/2009/nov/06/squad-sheets-manchester-city-burnley
Birmingham City,Chelsea,"Can the Premier League leaders upset the form book and win at St Andrew's? Not the question that most people would have imagined being asked ahead of this fixture but arguably a fair one on the back of recent results. Alex McLeish will name an unchanged side for the seventh successive match as Birmingham seek to stretch their unbeaten run to 10 games against a Chelsea side that have won only one of their last six. ""At St Andrew's we believe we have a good chance of beating anybody,"" said the Birmingham manager. Stuart James",Stuart James,St Andrew's,P Walton,"['23-4', '9-20', '14-5']",6.75,1.45,3.8,2009-12-24,https://www.theguardian.com/football/2009/dec/24/squad-sheets-chelsea-birmingham-city
Tottenham Hotspur,Sunderland,"At full strength Sunderland, after their performances against Manchester United and Liverpool, would be expected to get something from White Hart Lane but Steve Bruce is without the suspended Kenwyne Jones and has Lee Cattermole and Lorik Cana on a lengthening injury list. Nevertheless, Tottenham will need to regain some momentum after losing to Stoke City and Arsenal if they are to see off Bruce's improving side. According to tradition Darren Bent, Sunderland's leading marksmen, should score against his old colleagues. By no means a home banker this one, possibly a draw. David Lacey",David Lacey,White Hart Lane,K Friend,"['1-2', '5-1', '11-4']",1.5,6.0,3.75,2009-11-06,https://www.theguardian.com/football/2009/nov/06/squad-sheets-tottenham-hotspur-sunderland
Sunderland,Portsmouth,"With the club's off-field issues overshadowing what was a significant victory for Portsmouth last weekend, Avram Grant's men must focus on the pitch as they seek to record consecutive victories, a feat that has eluded them for some time now. That, though, is easier said than done, particularly with Sunderland's imperious home form – the side are unbeaten in the league at the Stadium of Light since August. Steve Bruce has injury problems in defence but Pompey's misfiring front-line has scored only three away goals this season. Lee Price",Lee Price,Stadium of Light,S Bennett,"['4-5', '3-1', '12-5']",1.8,4.0,3.4,2009-12-11,https://www.theguardian.com/football/2009/dec/11/sunderland-portsmouth-squad-sheets
Manchester United,Bolton Wanderers,"The story of Michael Owen's first two months at Old Trafford is that he appears to be reserved exclusively for Lancashire derbies. His first league start was at Burnley and Wayne Rooney's calf injury has ensured that his second will be against Bolton. His only goal has been the winner against Manchester City, when Alan Wiley's timekeeping rather than his fitness was the chief source of comment. Sir Alex Ferguson will await Dimitar Berbatov's return from Bulgaria after the birth of his child to assess how ready he is to play. Tim Rich",Tim Rich,Old Trafford,M Clattenburg,"['2-11', '12-1', '19-4']",1.1818181818181819,13.0,5.75,2009-10-16,https://www.theguardian.com/football/2009/oct/16/manchester-united-bolton-squad-sheets
