home_team,away_team,text,author,venue,referee,odds,odds_home_team,odds_away_team,odds_draw,preview_date,preview_link
Sunderland,Liverpool,"The international break has not been kind to Rafael Benítez. Liverpool have lost Steven Gerrard and Fernando Torres to injury since their 2-0 defeat to Chelsea two weeks ago and may have to field Lucas Leiva and Javier Mascherano at the Stadium of Light despite the pair having returned late from their World Cup exploits in South America. The Merseysiders have not lost consecutive league games since December 2007, but Sunderland, who must feel grateful that Fabio Capello continues to overlook Darren Bent, will fancy their chances after giving Manchester United a scare last time out. John Ashdown",John Ashdown,Stadium of Light,M Jones,"['16-5', '8-11', '5-2']",4.2,1.7272727272727273,3.5,2009-10-16,https://www.theguardian.com/football/2009/oct/16/sunderland-liverpool-squad-sheets
Burnley,Bolton Wanderers,"Burnley's manager, Owen Coyle, has revealed that his Wolves counterpart Mick McCarthy laughed when he told him his January transfer budget so an answer to the Turf Moor club's parlous away form must come from within. Burnley continue to rely on their performances at home, but the improvement in the teams around them mean that might not be enough. Bolton should at least be well rested after Monday's meeting with Wigan fell foul to the weather, but they have underperformed despite possessing a squad which on paper looks well-equipped to move up the table. James Callow",James Callow,Turf Moor,C Foy,"['5-4', '19-10', '11-5']",2.25,2.9,3.2,2009-12-24,https://www.theguardian.com/football/2009/dec/24/squad-sheets-burnley-bolton-wanderers
Chelsea,Liverpool,"The managers of these clubs might have been in an unwitting contest to decide who was the more irascible. Rafael Benítez had an advantage since his rage was stoked by Liverpool's defeat in Fiorentina. Given that he was handicapped by a win, away to Apoel Nicosia, Carlo Ancelotti did well to deplore the Chelsea display with such feeling. There is no doubting which man is in the greater difficulty – a loss for the visitors would be a third in a mere eight league fixtures. Chelsea, though, have the challenge of regaining form if they are to win. Kevin McCarra",Kevin McCarra,Stamford Bridge,M Atkinson,"['11-10', '11-5', '11-5']",2.1,3.2,3.2,2009-10-02,https://www.theguardian.com/football/2009/oct/02/squad-sheets-chelsea-liverpool
Aston Villa,Manchester City,"Aston Villa face quite a challenge to repeat last season's top-six finish since clubs such as Tottenham and, in particular, Manchester City have upgraded their squads. Martin O'Neill's side had been looking quite effective in the league, winning three matches in a row while keeping a clean sheet, but doubts about their defence were reawakened by the 2-1 loss to Blackburn. Villa, at home, still ought to present a test of City's credentials. Mark Hughes's team can at least be bolstered by Emmanuel Adebayor, who has completed his suspension. Kevin McCarra",Kevin McCarra,Villa Park,M Dean,"['6-4', '8-5', '11-5']",2.5,2.6,3.2,2009-10-02,https://www.theguardian.com/football/2009/oct/02/squad-sheets-aston-villa-manchester-city
Arsenal,Birmingham City,"The last time these two clubs met Eduardo suffered a broken leg and dislocated ankle, William Gallas staged a sit-down protest and Arsenal's season imploded. One can only imagine this will be a more sedate affair. The portents are not promising for Birmingham. Arsenal have won their previous six matches and scored four or more in each of their last four home fixtures. Birmingham, on the other hand, have lost four of their last five in the Premier League and not won at Arsenal since 1957. Carson Yeung, Birmingham's new president, was not even born then. Stuart James",Stuart James,Emirates Stadium,L Probert,"['3-20', '14-1', '12-5']",1.15,15.0,3.4,2009-10-16,https://www.theguardian.com/football/2009/oct/16/arsenal-birmingham-city-squad-sheets
Wigan Athletic,Manchester United,"Manchester United's 1-0 defeat at Burnley on Wednesday already represents one of the more astounding results that will happen in the entire Premier League season. United, however, are unlikely to play so badly again and have an immaculate record against Wigan since their promotion to the top division. The fit-again Nemanja Vidic and Gary Neville are in line to start but Rio Ferdiand is likely to miss out. Antonio Valencia, signed from Wigan for £17m earlier this summer, will be keen to impress against his old club. Daniel Taylor",Daniel Taylor,"DW Stadium, Saturday",H Webb,"['19-4', '1-2', '14-5']",5.75,1.5,3.8,2009-08-21,https://www.theguardian.com/football/2009/aug/21/squad-sheets-manchester-united-wigan-athletic
Blackburn Rovers,Liverpool,"Rafael Benítez spoke tentatively of a ""turning point"" following Liverpool's win over Everton last weekend, but Blackburn served notice against Chelsea in midweek of just how difficult it may be for the Reds to turn derby success into sustained momentum. Rovers' victory over Carlo Ancelotti's side in the Carling Cup, albeit on penalties, showed just how dangerous Sam Allardyce's side can be. ""They are going to have to play well, because we are at home and our home record is fantastic,"" said Allardyce's assistant, Neil McDonald. John Ashdown",John Ashdown,Ewood Park,M Atkinson,"['7-2', '7-10', '12-5']",4.5,1.7,3.4,2009-12-04,https://www.theguardian.com/football/2009/dec/04/squad-sheets-blackburn-rovers-liverpool
Everton,Wolverhampton Wanderers,"Unbeaten in six matches in all competitions, the mood is buoyant at Everton these days. Bar the opening day 6-1 thumping by Arsenal, David Moyes's team are based on a tight defence, and in Louis Saha he has one of the division's most potent strikers. They will expect nothing but a win. For Mick McCarthy there are only problems. His team have won only one away game and he will need the strikers to start firing soon if they are not to get stuck in a relegation scrap. Patrick Curry",Patrick Curry,Goodison Park,S Atwell,"['2-5', '6-1', '16-5']",1.4,7.0,4.2,2009-10-16,https://www.theguardian.com/football/2009/oct/16/everton-wolverhampton-wanderers-squad-sheets
Birmingham City,Sunderland,"Steve Bruce returns to St Andrew's with a Sunderland side in buoyant mood after victory over Liverpool. Bruce hopes to prove a point to his former club after his acrimonious departure in 2007, and with Darren Bent in sparkling form atop the division's scoring charts, stands every chance of gaining a second win over the Blues this term. In the first home game since Carson Yeung's arrival as Birmingham president, he will be watching from the stands as Alex McLeish seeks to heal their defensive frailty and keep their first clean sheet since August. Chris Bell",Chris Bell,St Andrew's,C Foy,"['8-5', '6-4', '11-5']",2.6,2.5,3.2,2009-10-23,https://www.theguardian.com/football/2009/oct/23/squad-sheets-birmingham-city-sunderland
Liverpool,Wolverhampton Wanderers,"The criticism Mick McCarthy attracted for his rotation policy must have left Rafael Benítez pining for the good old days. The time when the Liverpool manager was condemned merely for tinkering is long gone, and after the gutless showing at Portsmouth this is a test of his team's commitment as well as quality. Aston Villa and Tottenham follow in the league for Liverpool and they cannot afford to lose further ground in the pursuit of fourth place. McCarthy's selection at Anfield may provide another verdict on Liverpool's season. Andy Hunter",Andy Hunter,Anfield,A Marriner,"['1-5', '10-1', '19-4']",1.2,11.0,5.75,2009-12-24,https://www.theguardian.com/football/2009/dec/24/squad-sheets-liverpool-wolverhampton-wanderers
Wolverhampton Wanderers,Arsenal,"It is 30 years since Wolves defeated Arsenal and few will give Mick McCarthy's side much chance of bringing that run to an end. Arsenal are in scintillating form, having passed a half century of goals for the season against Alkmaar on Wednesday, and won five out of their last six in the Premier League. Arsène Wenger will be without the injured Gaël Clichy and Nicklas Bendtner, while Sylvan Ebanks-Blake returns to the Wolves forward line in place of the injured Chris Iwelumo after dropping to the bench against Stoke last Saturday. Stuart James",Stuart James,Molineux,S Bennett,"['13-2', '4-11', '16-5']",7.5,1.3636363636363638,4.2,2009-11-06,https://www.theguardian.com/football/2009/nov/06/squad-sheets-wolverhampton-wanderers-arsenal
Manchester City,Wolverhampton Wanderers,"These are truly glorious times for the new and improved Manchester City. Having beaten Blackburn last week, Mark Hughes' side then overcame Barcelona at Camp Nou on the same night local rivals United were losing at Burnley. But City being City, there remains every chance they will slip-up against a newly promoted side in front of their fans. Wolves also arrive at Eastlands buoyed by their midweek win at Wigan – their first ever away victory in the Premier League. Carlos Tevez should make his full debut for the hosts. Sachin Nakrani",Sachin Nakrani,"City of Manchester Stadium, Saturday",L Mason,"['1-4', '9-1', '4-1']",1.25,10.0,5.0,2009-08-21,https://www.theguardian.com/football/2009/aug/21/squad-sheets-manchester-city-wolverhampton-wanderers
Arsenal,Hull City,"Hull achieved one of the shocks of last season when they triumphed 2-1 at the Emirates in September 2008. A repeat seems highly unlikley as Hull's away form has been wretched in 2009 and they are without midfield dynamo Jimmy Bullard, whose troublesome knee threatens to derail any attempts to climb the table. Arsenal are not entirely without problems of their own, however; after scoring 36 goals in their first 11 games, they have manged just five in five without Robin van Persie who picked up an injury on international duty. Richard Flower",Richard Flower,Emirates Stadium,S Bennett,"['3-20', '14-1', '5-1']",1.15,15.0,6.0,2009-12-18,https://www.theguardian.com/football/2009/dec/18/squad-sheets-arsenal-hull-city
Portsmouth,Burnley,"Avram Grant is growing tired of the hypothetical. He and his squad face ongoing concerns regarding their pay and whether there will be money or even the dispensation to sign players in January, but they should know how important this fixture is to their hopes of staying in the Premier League. ""They are proud players and no sportsman would want to be [bottom of the league] – with money or without,"" said Grant. Burnley are in better shape but cannot afford to speculate on their own survival while their away form is so poor. James Callow",James Callow,Fratton Park,P Dowd,"['4-5', '3-1', '12-5']",1.8,4.0,3.4,2009-12-04,https://www.theguardian.com/football/2009/dec/04/squad-sheets-portsmouth-burnley
Wigan Athletic,Bolton Wanderers,"Bolton arrive at the DW Stadium outside the relegation zone after the midweek win over West Ham and the manager, Gary Megson, is determined to hold on to his best players in January to stay out of trouble. The high-scoring defender Gary Cahill, for one, is not leaving: ""There are players here who are untouchable,"" Megson said yesterday. Wigan are without Mohamed Diamé, ever-present so far, because of a knee ligament injury while Megson is likely to replace the suspended Fabrice Muamba with Chris Basham. Marcus Christenson",Marcus Christenson,DW Stadium,A Wiley,"['1-1', '12-5', '9-4']",2.0,3.4,3.25,2009-12-18,https://www.theguardian.com/football/2009/dec/18/squad-sheets-wigan-athletic-bolton-wanderers
Blackburn Rovers,Stoke City,"Surviving for three years is the key to Premier League longevity, according to Stoke manager Tony Pulis, and his hard-working, no-frills Potters are already looking a safe bet to make it safely to the end of year two. That some supporters would like to see the team play with a touch more style, and ideally feature Tuncay Sanli from the start, is unlikely to affect the Welshman's thinking as he seeks to bring to an end Blackburn's run of five successive home victories. Captain Abdoulaye Faye returns after suspension and should go straight back into the side. Richard Rae",Richard Rae,Ewood Park,H Webb,"['9-10', '13-5', '12-5']",1.9,3.6,3.4,2009-11-27,https://www.theguardian.com/football/2009/nov/27/squad-sheets-blackburn-rovers-stoke-city
Arsenal,Tottenham Hotspur,"Robbie Keane's belief that Tottenham have a squad that is at least the equal of Arsenal's smacked of boldness if not delusion. In their most recent trip to meet one of the Champions League clubs, his team were beaten 3-0 by Chelsea. Tottenham have not defeated Arsenal in almost a decade, a run of 19 matches without a win over their north London rivals. The clubs, however, are now adjacent in the table and an attacker such as Keane must believe he can exploit weaknesses in Arsène Wenger's line-up . Kevin McCarra",Kevin McCarra,Emirates Stadium,M Clattenburg,"['11-20', '9-2', '13-5']",1.55,5.5,3.6,2009-10-30,https://www.theguardian.com/football/2009/oct/30/squad-sheets-arsenal-tottenham-hotspur
Portsmouth,Tottenham Hotspur,"Jermain Defoe, Peter Crouch and Niko Kranjcar join Harry Redknapp and his coaching staffin what is likely to be a fractious reunion on the south coast. The hosts, buoyed by their latest takeover and their first points of the season, could conceivably hoist themselves from the foot with a win, but Spurs are third and potent even on their travels these days. The corresponding fixture was won courtesy of goals from Defoe and Crouch last season. Pompey must ensure that scenario is not repeated if they are to leave Redknapp defeated and deflated. Dominic Fifield",Dominic Fifield,Fratton Park,P Dowd,"['3-1', '4-5', '12-5']",4.0,1.8,3.4,2009-10-16,https://www.theguardian.com/football/2009/oct/16/portsmouth-tottenham-hotspur-squad-sheets
