home_team,away_team,text,author,venue,referee,odds,odds_home_team,odds_away_team,odds_draw,preview_date,preview_link
Manchester City,Chelsea,"Mark Hughes will know perfectly well why his team have drawn seven Premier League matches in a row. Manchester City have led in four of them while scoring 10 goals in total. The defence is the obvious problem, yet Hughes spent £56m in the summer on a goalkeeper, two centre-halves and a left-back. That department of the team had better coalesce very soon since Chelsea, joint top scorers with Arsenal in the league, are the visitors. If City are in luck, Didier Drogba and others will be a little jaded following the Carling Cup loss to Blackburn on penalties after extra-time. Kevin McCarra",Kevin McCarra,City of Manchester Stadium,H Webb,"['11-4', '17-20', '12-5']",3.75,1.85,3.4,2009-12-04,https://www.theguardian.com/football/2009/dec/04/squad-sheets-manchester-city-chelsea
Sunderland,Blackburn Rovers,"As a former Newcastle United manager, Blackburn's Sam Allardyce can expect a hot reception. Steve Bruce, meanwhile, anticipates a somewhat gruelling afternoon. ""Sam is very, very well organised and his teams play to a system which is not always easy on the eye but is very effective,"" said Sunderland's manager. ""But these are the games we are going to be judged on."" This is the home side's third match in a week and, with injuries mounting, it will be intriguing to see if Bruce offers fit crowd favourite Andy Reid a start. Louise Taylor",Louise Taylor,"Stadium of Light, Saturday",A Wiley,"['1-1', '12-5', '9-4']",2.0,3.4,3.25,2009-08-21,https://www.theguardian.com/football/2009/aug/21/squad-sheets-sunderland-blackburn-rovers
Aston Villa,Hull City,"Not so long ago Aston Villa would have viewed this as a routine victory but Hull City's recent revival suggests this could be a slightly awkward fixture for Martin O'Neill's team. Hull arrive on the back of a four-match unbeaten run and if the goal celebration that Jimmy Bullard and his team-mates choreographed at Manchester City last Saturday is anything to go by, team spirit has returned. Stewart Downing is set to make his first League start for Villa who will be in buoyant mood after securing a place in the Carling Cup semi-final. Stuart James",Stuart James,Villa Park,S Attwell,"['9-20', '21-4', '3-1']",1.45,6.25,4.0,2009-12-04,https://www.theguardian.com/football/2009/dec/04/squad-sheets-aston-villa-hull-city
Wolverhampton Wanderers,Burnley,"Judgment day for Mick McCarthy. Having claimed he fielded the strongest side available when he controversially made 10 changes for the midweek trip to Old Trafford, the Wolves manager is expected to revert to his other strongest side against Burnley. Dave Edwards is injured but the other nine players who rested are set to return for a match that Wolves must win to vindicate McCarthy's decision. Anything less and Burnley will be celebrating a rare journey home without defeat and football fans everywhere will be having a good chuckle. Stuart James",Stuart James,Molineux,M Atkinson,"['1-1', '12-5', '9-4']",2.0,3.4,3.25,2009-12-18,https://www.theguardian.com/football/2009/dec/18/squad-sheets-wolverhampton-wanderers-burnley
West Ham United,Everton,"West Ham face a nemesis in somewhat brighter mood. The Londoners have a poor recent home record against Everton but Wednesday's late victory over Aston Villa will give them hope of ending the run. A major concern, however, is the loss of top-scorer Carlton Cole, who has a hamstring strain, but Everton have injury concerns of their own and come into this fixture on the back of a particularly poor run – David Moyes's men have not won any of their past seven fixtures in all competitions. Sachin Nakrani",Sachin Nakrani,Upton Park,A Wiley,"['7-5', '17-10', '11-5']",2.4,2.7,3.2,2009-11-06,https://www.theguardian.com/football/2009/nov/06/squad-sheets-west-ham-united-everton
Chelsea,Everton,"Carlo Ancelotti described the midweek draw with Apoel Nicosia as the worst performance of his reign and since it came on the back of defeat at Manchester City, Chelsea's two-point lead at the top of the Premier League is looking more precarious than it should given the problems that have beset the other title contenders. Everton, though, have problems of their own, with last weekend's spirited draw with Tottenham barely concealing a glut of injuries and a general lack of confidence within David Moyes' squad. Paul Doyle",Paul Doyle,Stamford Bridge,P Dowd,"['2-9', '10-1', '21-5']",1.2222222222222223,11.0,5.2,2009-12-11,https://www.theguardian.com/football/2009/dec/11/chelsea-everton-squad-sheets
Everton,Liverpool,"For so long divided, now the Merseyside rivals are united by misery. That there is little else at stake but managerial reputations exposes the depressed state of football in the city. Between them these sides have won just three of their last 21 matches in all competitions, and they arrive at Goodison Park on the back of a humiliation at Hull (Everton), out of the Champions League (Liverpool) and with no new stadium on the horizon (both). At least for Rafael Benítez there are signs of progress with injuries, and he would be well-advised not to mention his misfortune with them within earshot of David Moyes. Andy Hunter",Andy Hunter,Goodison Park,A Wiley,"['11-5', '11-10', '11-5']",3.2,2.1,3.2,2009-11-27,https://www.theguardian.com/football/2009/nov/27/squad-sheets-everton-liverpool
Liverpool,Aston Villa,"Despite their 4-0 win over Stoke, Liverpool remain a club rocking on its heels following the departure of Xabi Alonso and a clutch of injuries that has left the squad looking bare. But after the opening day defeat at White Hart Lane, another reversal so soon into the new season is unthinkable. It helps, then, that they are facing a side that has lost its last two games and failed to score on either occasion. Aston Villa could also be without Curtis Davies after he injured his shoulder in Thursday's defeat to Rapid Vienna. Sachin Nakrani",Sachin Nakrani,"Anfield, Monday",M Atkinson,"['9-20', '6-1', '11-4']",1.45,7.0,3.75,2009-08-21,https://www.theguardian.com/football/2009/aug/21/squad-sheets-liverpool-aston-villa
Wigan Athletic,Fulham,"Matches between these sides tend to produce very few goals and with the Wigan manager, Roberto Martínez, claming his side are ""light up front"" this may be another barren meeting. Fulham will be looking to put Thursday's Europa League disappointment behind them and recapture the form that saw them beat Liverpool 3-1 in their last Premier League outing. Damien Duff is likely to be absent for the visitors but Erik Edman could make his first league start for Wigan since March 2008 in place of the injured Maynor Figueroa. Richard Flower",Richard Flower,DW Stadium,M Clattenburg,"['5-4', '19-10', '11-5']",2.25,2.9,3.2,2009-11-06,https://www.theguardian.com/football/2009/nov/06/squad-sheets-wigan-athletic-fulham
Hull City,West Ham United,"With so much attention on Hull's manager Phil Brown going into their injury-time win over Stoke last time out, the return of Jimmy Bullard went relatively unremarked, but the Londoner's galvanic midfield efforts brought the scrappy but determined best out of the Tigers. Another concern for West Ham fans is that Gianfranco Zola's side has been playing well without getting the results, and with relegation likely to mean financial meltdown for each of these clubs, they badly need to leave Humberside with at least a point. Harry Polkey",Harry Polkey,KC Stadium,M Clattenburg,"['17-10', '7-5', '11-5']",2.7,2.4,3.2,2009-11-20,https://www.theguardian.com/football/2009/nov/20/squad-sheets-hull-city-west-ham
Chelsea,Wolverhampton Wanderers,"Despite injuries to key players this is a game Chelsea should win easily. The interest, then, lies elsewhere. First, there is Kevin Doyle's reunion with Nicolas Anelka and Florent Malouda days after his heart was broken in Paris. Given the nature of France's win, a sly tackle from the Wolves striker would hardly be a surprise. And speaking of French players, the inclusion of Gaël Kakuta on Chelsea's bench is also notable. The teenager has been the centre of some angst for the hosts but no one will complain should he come on to score the winner. Sachin Nakrani",Sachin Nakrani,Stamford Bridge,L Mason,"['1-7', '16-1', '5-1']",1.1428571428571428,17.0,6.0,2009-11-20,https://www.theguardian.com/football/2009/nov/20/squad-sheets-chelsea-wolverhampton-wanderers
West Ham United,Tottenham Hotspur,"The current league leaders step out into the feverish atmosphere generated by this fixture attempting to maintain rare momentum. It took Tottenham 10 games last season to muster the six points they boast from two fixtures this time around, and eight, seven and six matches in the three years before. The midweek thumping of Hull City sharpened Jermain Defoe up for a return to his former club though West Ham, impressive in defeating Wolves and a slick threat under Gianfranco Zola, will provide a sterner test of their mettle. Dominic Fifield",Dominic Fifield,Upton Park,M Clattenburg,"['9-5', '5-4', '23-10']",2.8,2.25,3.3,2009-08-21,https://www.theguardian.com/football/2009/aug/21/squad-sheets-west-ham-tottenham
Fulham,Sunderland,"Sunderland under Steve Bruce have become a model of inconsistency. This is a side capable of beating Arsenal one week, drawing at Old Trafford the next, but also of losing at Wigan or Birmingham. Fulham will provide stern opposition even after the distraction of a midweek Europa League win, with the Cottagers unbeaten on home territory since September. Neither of these sides appears in danger of being sucked into a relegation scrap; whether either can muscle passage among those currently above them, however, is less certain. Dominic Fifield",Dominic Fifield,Craven Cottage,M Dean,"['11-10', '11-5', '11-5']",2.1,3.2,3.2,2009-12-04,https://www.theguardian.com/football/2009/dec/04/squad-sheets-fulham-sunderland
Aston Villa,Stoke City,"After back-to-back victories against the odds Martin O'Neill's Aston Villa side must reacquaint themselves with starting as the favourite. ""Mentally we will be right,"" said O'Neill. ""Physically it will be very demanding."" Stoke's toughness at the Britannia Stadium has yet to be replicated on their travels, where they have won just once this season in the Premier League. Victory for the home side would set them up perfectly for their challenging post-Christmas trip to London to face Arsenal at the Emirates. John Ashdown",John Ashdown,Villa Park,L Probert,"['2-5', '13-2', '3-1']",1.4,7.5,4.0,2009-12-18,https://www.theguardian.com/football/2009/dec/18/squad-sheets-aston-villa-stoke-city
Burnley,Birmingham City,"A visit to Turf Moor is a daunting prospect, particularly for a Birmingham side who have struggled for goals and been ravaged by injury problems all season. The visitors' task may be made even tougher by the return of Burnley's captain Steven Caldwell, who missed the start of the season with a groin complaint. It is not all good news for the manager Owen Coyle, however, as Jay Rodriguez has joined Chris McCann and Martin Paterson on the long-term injury list after fracturing an ankle in training. Richard Flower",Richard Flower,Turf Moor,K Friend,"['5-4', '19-10', '11-5']",2.25,2.9,3.2,2009-10-02,https://www.theguardian.com/football/2009/oct/02/squad-sheets-burnley-birmingham-city
Hull City,Bolton Wanderers,"Any optimism generated by Hull's narrow defeat at Chelsea in their opening fixture was quickly dissipated by the manner in which Phil Brown's side was dismantled by Spurs in midweek. Bolton also made a poor start at home to Sunderland but their new signings Sean Davis, Paul Robinson, Zat Knight and Sam Ricketts give them scope for improvement while Brown will be hoping the American striker Jozy Altidore, available after visa problems, can give his toothless Tigers some bite up front. One thing is for sure – it won't be pretty. Richard Rae",Richard Rae,"KC Stadium, Saturday",M Jones,"['27-20', '7-4', '11-5']",2.35,2.75,3.2,2009-08-21,https://www.theguardian.com/football/2009/aug/21/squad-sheets-hull-bolton
Hull City,Blackburn Rovers,"One of the reasons Hull have improved in recent weeks is because their manager, Phil Brown, is spending more time coaching and less in the media, according to the City chairman, Adam Pearson. Unfortunately for the Tigers, an even bigger reason for their resurgence, Jimmy Bullard, is crocked again and is likely to be replaced by Seyi Olofinjana. After beating Chelsea in the Carling Cup and easily holding Liverpool in the league, Blackburn will fancy their chances of ending Hull's run of five home matches unbeaten. Richard Rae",Richard Rae,KC Stadium,C Foy,"['17-10', '7-5', '11-5']",2.7,2.4,3.2,2009-12-11,https://www.theguardian.com/football/2009/dec/11/hull-blackburn-squad-sheets
Fulham,Bolton Wanderers,"Bolton have yet to win a Premier League match at Fulham, something they do not look best-placed to change having taken three points from their last five matches. Goals have been the problem – Johan Elmander has scored just once while Kevin Davies, who scored 12 in the league last season, has only two so far this time around. He does, though, have a staunch supporter in Roy Hodgson, who paid £7m to bring him to Blackburn in 1998. ""I'm pleased to see I'm not totally incompetent when looking at forward players,"" Hodgson said. Fulham have Andy Johnson and Danny Murphy available again while Tamir Cohen should be back for Bolton. Barney Ronay",Barney Ronay,Craven Cottage,S Bennett,"['17-20', '3-1', '9-4']",1.85,4.0,3.25,2009-11-27,https://www.theguardian.com/football/2009/nov/27/squad-sheets-fulham-bolton-wanderers
Arsenal,Stoke City,"Arsenal are losing games – three of their last four – while Arsène Wenger is just losing it. Not the best of times, then, to meet a Stoke side adding a touch of style to their pragmatism. On their previous visit to north London, Tony Pulis's team withstood a prolonged barrage from Tottenham before grabbing a late winner and they will seek to punish Arsenal on the break. Wenger's attacking options have been further reduced by Theo Walcott's latest injury and with Alex Song suspended the Emirates could be in for a frustrating afternoon. David Lacey",David Lacey,Emirates Stadium,M Clattenburg,"['1-4', '9-1', '4-1']",1.25,10.0,5.0,2009-12-04,https://www.theguardian.com/football/2009/dec/04/squad-sheets-arsenal-stoke-city
Burnley,Wigan Athletic,"Both managers are new to the Premier League and it says much for Wigan under Roberto Martínez that they were disappointed last Sunday not to add Manchester City's scalp to Chelsea's. A point, Martínez felt, did not reflect their domination but he hopes to ""take the good things"" into this game, such as the competitiveness of Hendry Thomas and Mohamed Diame, both in the league's top five tacklers. Those two games, though, were at home. Owen Coyle's Burnley have a 100% record at Turf Moor, thriving on high tempo. Jeremy Alexander",Jeremy Alexander,Turf Moor,L Mason,"['13-10', '9-5', '11-5']",2.3,2.8,3.2,2009-10-23,https://www.theguardian.com/football/2009/oct/23/burnley-wiganathletic
Hull City,Manchester United,"Every away game will provoke trepidation until Manchester United can once more send out a group of fit, established defenders. Although Hull are no Fulham, who beat Sir Alex Ferguson's side 3-0, they will see an opportunity. The home team are just above the relegation zone but that ought to make them all the keener to grasp any opportunity presented to them. Hull's problem is that they, too, are vulnerable and United should attack with far more purpose than they did at Craven Cottage. Kevin McCarra",Kevin McCarra,KC Stadium,A Wiley,"['13-2', '7-20', '7-2']",7.5,1.35,4.5,2009-12-24,https://www.theguardian.com/football/2009/dec/24/squad-sheets-hull-city-manchester-united
Wigan Athletic,Blackburn Rovers,"Wigan are without a win in three games and Blackburn have not triumphed in their last six, but while both Lancashire clubs require a victory, the first task is to ensure they have a game at all. Monday's match against Bolton was postponed and Wigan have since hired a snowplough and bought seven tonnes of grit in a bid to make the DW Stadium accessible. A different sort of grit is sure to be required in a game that does not promise prettiness. The corresponding fixture last season provided Sam Allardyce with employment after Wigan's emphatic 3-0 win prompted Blackburn to dismiss Paul Ince. Richard Jolly",Richard Jolly,DW Stadium,M Clattenburg,"['13-10', '9-5', '11-5']",2.3,2.8,3.2,2009-12-24,https://www.theguardian.com/football/2009/dec/24/squad-sheets-wigan-athletic-blackburn-rovers
Bolton Wanderers,Manchester City,"Bolton have won once at home, the least in the division. City have lost once anywhere, likewise the least, and have now stopped drawing; having beaten Chelsea, they even have Robinho pledging himself to the club for 10 years. No wonder Gary Megson is manning the ramparts: ""We have to roll up our sleeves. We'll never be found wanting for effort and honesty. The confidence is there, as is the desire."" So is Kevin Davies, back from suspension and ""a focal point"". He may determine how long the confidence remains. Jeremy Alexander",Jeremy Alexander,Reebok Stadium,M Clattenburg,"['3-1', '4-5', '12-5']",4.0,1.8,3.4,2009-12-11,https://www.theguardian.com/football/2009/dec/11/bolton-manchester-city-squad-sheets
Birmingham City,Fulham,"Roy Hodgson is likely to name Damien Duff in his line-up despite the fact Duff played all 120 minutes of Ireland's match with France on Wednesday. ""When he came back he was really badly affected,"" Hodgson said. ""The thing about Damien is when he gets on the field and that ball's there in front of him he has that ability to put other problems out of his mind."" Few problems for Fulham of late: they travel to St Andrew's unbeaten in five matches, albeit without Danny Murphy. For Birmingham Barry Ferguson returns and Keith Fahey is fit again. Barney Ronay",Barney Ronay,St Andrew's,C Foy,"['27-20', '7-4', '11-5']",2.35,2.75,3.2,2009-11-20,https://www.theguardian.com/football/2009/nov/20/squad-sheets-birmingham-city-fulham
Burnley,Aston Villa,"The shockwaves from Wednesday's seismic events at Stade de France may be felt in deepest, darkest Lancashire, with Martin O'Neill undecided as to whether he will play the ""very, very disappointed"" Richard Dunne. ""Let me put it this way, he won't get over it overnight. I will sit down with him if we get an opportunity to see how he is feeling,"" said the Aston Villa manager. Former Republic of Ireland international Owen Coyle will be feeling fine if his Burnley side can secure their sixth win in seven home games. Mikey Stafford",Mikey Stafford,Turf Moor,H Webb,"['21-10', '11-10', '23-10']",3.1,2.1,3.3,2009-11-20,https://www.theguardian.com/football/2009/nov/20/squad-sheets-burnley-aston-villa
Tottenham Hotspur,Stoke City,"The lasting strength of Tottenham's claim to a finish in the top four will be decided by how well Harry Redknapp's squad stand up to the rigours of winter, especially at the back with its recurrent aches and strains. Going forward Spurs have more options and Stoke's away form does not suggest they will be able to deny the opposition a win to stay in third place. However, Tony Pulis's side are nothing if not stubborn and Redknapp may need the lofty presence of Peter Crouch at some time or other to break them down. David Lacey",David Lacey,White Hart Lane,L Probert,"['2-5', '13-2', '3-1']",1.4,7.5,4.0,2009-10-23,https://www.theguardian.com/football/2009/oct/23/squad-sheets-tottenham-hotspur-stoke
Aston Villa,Bolton Wanderers,"Back-to-back 4-0 defeats against Chelsea may have dented Bolton's confidence, but they have travelled well this season, picking up three points at St Andrew's on their last visit to the second city at the end of September and face a Villa side stuttering after one win in their last six league games. Kevin Davies is optimistic that they can bounce back. ""I've been speaking to the players and it hurts,"" he said. ""But the only way to respond is to get to the next game and take your anger and frustration down there. John Ashdown",John Ashdown,Villa Park,C Foy,"['13-20', '15-4', '5-2']",1.65,4.75,3.5,2009-11-06,https://www.theguardian.com/football/2009/nov/06/squad-sheets-aston-villa-bolton-wanderers
West Ham United,Arsenal,"It is a measure of the serenity of Arsenal's progress that perhaps the biggest issue for Arsène Wenger is whether to persist with Vito Mannone in goal, or recall the now virus-free Manuel Almunia, who has stewed on the bench for the past two games. Mannone has had both excellent and erratic moments and Wenger is keen not only to accelerate his development but to reassure other players that they, too, can force their way in. What West Ham would give for such trifling worries. Another fraught afternoon beckons for them. David Hytner",David Hytner,Upton Park,S Bennett,"['5-1', '1-2', '11-4']",6.0,1.5,3.75,2009-10-23,https://www.theguardian.com/football/2009/oct/23/squad-sheets-west-ham-arsenal
Stoke City,Wigan Athletic,"This early kick-off is heaven sent for Tony Pulis – the sooner the Stoke manager's team get back on the field the sooner he can stop deflecting awkward questions about his alleged headbutt of James Beattie after last weekend's defeat at Arsenal. He will be happy too that it is Roberto Martínez's Wigan he is facing, as the Latics have conceded 13 goals in their last two away fixtures. If the Spaniard is to arrest this trend in the intimidating atmosphere of the Britannia he and his players will have to put their heads together. Mikey Stafford",Mikey Stafford,Britannia Stadium,M Dean,"['1-1', '12-5', '9-4']",2.0,3.4,3.25,2009-12-12,https://www.theguardian.com/football/2009/dec/11/stoke-wigan-squad-sheets
Burnley,Fulham,"The bloggers that revel in insulting Bobby Zamora will surely go quiet should he again steer Fulham to victory. Such an outcome would not only lift the Londoners to seventh place but also give them their first victory at Turf Moor since the era of King George VI. The hosts will not topple easily, however. They have been excellent at home so far this season and will want to win again having lost their last two league fixtures. David Nugent is also likely to return for Burnley having been illegible to face Portsmouth last week. Sachin Nakrani",Sachin Nakrani,Turf Moor,A Wiley,"['31-20', '31-20', '11-5']",2.55,2.55,3.2,2009-12-11,https://www.theguardian.com/football/2009/dec/11/burnley-fulham-squad-sheets
Everton,Birmingham City,"Irony is invariably of the cruel variety for Everton and David Moyes. Jack Rodwell – arguably his most important first-team regular to feature against BATE Borisov in midweek – became the latest of Moyes's charges to pull up lame. While Everton's best team remains a moveable feast the Birmingham manager Alex McLeish is expected to name an unchanged side for the sixth game in succession, winning their last five. McLeish wants to add to his squad in January; Moyes would just settle for some of his to begin training. James Callow",James Callow,Goodison Park,S Attwell,"['8-11', '100-30', '12-5']",1.7272727272727273,4.333333333333334,3.4,2009-12-18,https://www.theguardian.com/football/2009/dec/18/squad-sheets-everton-birmingham-city
Bolton Wanderers,Chelsea,"Chelsea cannot flirt with complacency against the side they demolished in the Carling Cup. Wednesday's 4-0 win was the third successive rout at Stamford Bridge, with 13 goals scored and none conceded, but Carlo Ancelotti's last two journeys north brought defeat at Wigan and Aston Villa. Bolton, despite their meagre cup offering, should provide a truer test of Chelsea's conviction than recent home form. They are unbeaten in four at home and Gary Megson's fortunes were rising until he gave fringe players a chance they failed to take. Andy Hunter",Andy Hunter,Reebok Stadium,P Walton,"['13-2', '2-5', '3-1']",7.5,1.4,4.0,2009-10-30,https://www.theguardian.com/football/2009/oct/30/squad-sheets-bolton-wanderers-chelsea
Aston Villa,Chelsea,"Chelsea's victory at Villa Park in February was their first at the ground since 2000. Tomorrow's fixture ought to be demanding for Carlo Ancelotti's team, who were beaten 3-1 at Wigan in their last away game in the league. Villa led the expensively assembled Manchester City 1-0 earlier this month in the eventual draw. Containing the visitors will be difficult, particularly because of the outstanding form for Chelsea of Didier Drogba, who also scored last weekend to confirm Ivory Coast's place at the 2010 World Cup. Kevin McCarra",Kevin McCarra,Villa Park,S Bennett,"['3-1', '4-5', '12-5']",4.0,1.8,3.4,2009-10-16,https://www.theguardian.com/football/2009/oct/16/aston-villa-chelsea-squad-sheets
Wigan Athletic,Sunderland,"""Sunday was a hurtful day and a hurtful experience,"" said the Wigan manager Roberto Martínez in the wake of last weekend's 9-1 drubbing against Tottenham. ""The humiliation comes if you're not able to find the answers or become stronger afterwards."" After the pain of White Hart Lane Steve Bruce's return to the Latics for the first time since his summer departure, and the sniping it has brought, has been something of a welcome distraction. Darren Bent could be fit to make a surprise start for the visitors. John Ashdown",John Ashdown,DW Stadium,M Atkinson,"['7-5', '8-5', '23-10']",2.4,2.6,3.3,2009-11-27,https://www.theguardian.com/football/2009/nov/27/squad-sheets-wigan-athletic-sunderland
